0-fd-lvizrY	/public/huggingface-datasets/Aimind-dataset-share/Audioset/data/balanced_train/balanced_train_15/0-fd-lvizrY_30.0.mp4	When the sun is shining through the earth	0.000	10.020
RZgn6kfaJP8	/public/huggingface-datasets/Aimind-dataset-share/Audioset/data/balanced_train/balanced_train_18/RZgn6kfaJP8_30.0.mp4	caught in their eye or Charlie from Lost Eye or something? So let's just stick to why people cry when they're emotional for the sake of this episode. So first let's talk about the actual physical act of crying, though it may	0.000	13.350
kvRx-I-gyAo	/public/huggingface-datasets/Aimind-dataset-share/Audioset/data/balanced_train/balanced_train_19/kvRx-I-gyAo_150.0.mp4	The cash drawer, if you're leaving it on its own, can be locked by using the turn keys, as you can see here.	0.000	11.610
TWTsgG7EOmk	/public/huggingface-datasets/Aimind-dataset-share/Audioset/data/balanced_train/balanced_train_05/TWTsgG7EOmk_450.0.mp4	Watch it. It comes off in a few days.	0.000	11.610
ixpNpGZCEmU	/public/huggingface-datasets/Aimind-dataset-share/Audioset/data/balanced_train/balanced_train_02/ixpNpGZCEmU_0.0.mp4	Hello guys and welcome back to the final part of the Sims 4 Bachelor where the elimination the final elimination	0.450	9.990
xiA5BexwBhs	/public/huggingface-datasets/Aimind-dataset-share/Audioset/data/balanced_train/balanced_train_07/xiA5BexwBhs_190.0.mp4	I feel even better on your back. And if that's not something that he likes, then...	0.090	14.490
-xeYpMf97eU	/public/huggingface-datasets/Aimind-dataset-share/Audioset/data/balanced_train/balanced_train_06/-xeYpMf97eU_180.0.mp4	I mean why else would they put it in here? Oh geez don't go over there. It's gotta be. There's gotta be something here right? Yeah maybe.	0.420	12.540
oL4bNCYL9-o	/public/huggingface-datasets/Aimind-dataset-share/Audioset/data/balanced_train/balanced_train_17/oL4bNCYL9-o_110.0.mp4	Hmm, any more adventures here?	1.320	10.800
Afmp32GPijM	/public/huggingface-datasets/Aimind-dataset-share/Audioset/data/balanced_train/balanced_train_10/Afmp32GPijM_210.0.mp4	Sorry about that. I thought you were one of them.	0.690	14.820
n1zRnTCaiE0	/public/huggingface-datasets/Aimind-dataset-share/Audioset/data/balanced_train/balanced_train_03/n1zRnTCaiE0_40.0.mp4	They have kortosis armor! Mine!	1.590	10.410
2kXGRUblg3w	/public/huggingface-datasets/Aimind-dataset-share/Audioset/data/balanced_train/balanced_train_10/2kXGRUblg3w_30.0.mp4	out to fight them. Anyone could kill a man, anyone could take his scalp, but only the bravest warrior can conquer and fight with no weapon.	0.000	10.020
O6-GssSyYSs	/public/huggingface-datasets/Aimind-dataset-share/Audioset/data/balanced_train/balanced_train_19/O6-GssSyYSs_30.0.mp4	Where's your foot on the clutch? Ready? Chip, I ask you not to shift until we're ready.	0.000	10.020
YVEqyQjyy1Q	/public/huggingface-datasets/Aimind-dataset-share/Audioset/data/balanced_train/balanced_train_10/YVEqyQjyy1Q_170.0.mp4	I'm all about my bass, about my bass About my bass, about my bass, hey, hey Yeah, yeah, ooh	0.000	10.920
1JbzuVEv3Sw	/public/huggingface-datasets/Aimind-dataset-share/Audioset/data/balanced_train/balanced_train_06/1JbzuVEv3Sw_60.0.mp4	Very fairly simple and added a little bit of reverb, add a little bit of hole and do it like this.	0.000	9.630
2wajg-UP-Gs	/public/huggingface-datasets/Aimind-dataset-share/Audioset/data/balanced_train/balanced_train_15/2wajg-UP-Gs_0.0.mp4	You up for a race?	0.510	9.990
YkWBpSZWhHA	/public/huggingface-datasets/Aimind-dataset-share/Audioset/data/balanced_train/balanced_train_04/YkWBpSZWhHA_1.0.mp4	I'd ask you who you want to win this matchup, JR, but it's been pretty obvious since the start of the show who you're playing for. My primary name is objective as I...	1.710	10.560
wMsb7moPV2M	/public/huggingface-datasets/Aimind-dataset-share/Audioset/data/balanced_train/balanced_train_09/wMsb7moPV2M_300.0.mp4	When the turn is completed the inside door will naturally speed up and reduce	4.950	10.980
eFaU3xANLyQ	/public/huggingface-datasets/Aimind-dataset-share/Audioset/data/balanced_train/balanced_train_15/eFaU3xANLyQ_370.0.mp4	Connect it to the upper length.	4.440	5.730
Fq5rUJfqf3I	/public/huggingface-datasets/Aimind-dataset-share/Audioset/data/balanced_train/balanced_train_15/Fq5rUJfqf3I_270.0.mp4	500 babies growing in the nursery in the garage. This is the initial setup.	0.000	11.070
jLF55fcHvMU	/public/huggingface-datasets/Aimind-dataset-share/Audioset/data/balanced_train/balanced_train_06/jLF55fcHvMU_30.0.mp4	Shamin' took my friend to die just for God to get through to me Movin' me from everything into life became new to me Told the world I'm goin' gospel and look what they do to me	0.000	10.170
ttCOebeJ59A	/public/huggingface-datasets/Aimind-dataset-share/Audioset/data/balanced_train/balanced_train_04/ttCOebeJ59A_510.0.mp4	So keep everybody away from the two sides of the building. There's no one on that. That's a harbor.	0.000	12.870
DFPu83ggTlM	/public/huggingface-datasets/Aimind-dataset-share/Audioset/data/balanced_train/balanced_train_05/DFPu83ggTlM_160.0.mp4	He was lame	0.300	7.800
bJ424-lPwV4	/public/huggingface-datasets/Aimind-dataset-share/Audioset/data/balanced_train/balanced_train_01/bJ424-lPwV4_120.0.mp4	we'll do some drifting. And under the hood is a bone stock 3.5 liter Ford EcoBoost engine. It has a K&N intake	0.000	12.600
6DaAjyPOInQ	/public/huggingface-datasets/Aimind-dataset-share/Audioset/data/balanced_train/balanced_train_09/6DaAjyPOInQ_30.0.mp4	You see, we could have crafted this adventure game in which players would experience the trauma	0.120	11.160
dPoMaO6ofpk	/public/huggingface-datasets/Aimind-dataset-share/Audioset/data/balanced_train/balanced_train_04/dPoMaO6ofpk_40.0.mp4	Here's the problem though. That doesn't work.	0.030	10.560
vMyDwhYMj7Y	/public/huggingface-datasets/Aimind-dataset-share/Audioset/data/balanced_train/balanced_train_07/vMyDwhYMj7Y_200.0.mp4	It's my favorite thing to do.	0.060	10.710
aRb7xGc92aE	/public/huggingface-datasets/Aimind-dataset-share/Audioset/data/balanced_train/balanced_train_14/aRb7xGc92aE_30.0.mp4	So the onion will basically stay intact until I cut it. I'm going to cut the onion in half.	0.000	14.250
ab8V7MYQVyg	/public/huggingface-datasets/Aimind-dataset-share/Audioset/data/balanced_train/balanced_train_05/ab8V7MYQVyg_190.0.mp4	Yeah! Am I the only one? Yeah! Am I the sexual one? Yeah!	0.030	9.360
Tib9q48R1GQ	/public/huggingface-datasets/Aimind-dataset-share/Audioset/data/balanced_train/balanced_train_13/Tib9q48R1GQ_30.0.mp4	Hey! Come here! I gotta ask you a question. Huh? Hey, what do you know about-	2.910	10.650
g0aOPWwNMFQ	/public/huggingface-datasets/Aimind-dataset-share/Audioset/data/balanced_train/balanced_train_03/g0aOPWwNMFQ_80.0.mp4	A smile.	1.200	13.050
38GlRi84NJo	/public/huggingface-datasets/Aimind-dataset-share/Audioset/data/balanced_train/balanced_train_13/38GlRi84NJo_30.0.mp4	I started playing drums back when I was probably around 14 years old. My entire life, Zildjian	0.000	15.000
6VOGlqLeOzI	/public/huggingface-datasets/Aimind-dataset-share/Audioset/data/balanced_train/balanced_train_18/6VOGlqLeOzI_30.0.mp4	I'm sick right now.	2.730	10.500
eeyKoBYP1r0	/public/huggingface-datasets/Aimind-dataset-share/Audioset/data/balanced_train/balanced_train_13/eeyKoBYP1r0_70.0.mp4	belong to the recontest. I've now chucked it on its inside edge and I'm turning the flat of it.	0.000	9.300
ILCjO1sCcyM	/public/huggingface-datasets/Aimind-dataset-share/Audioset/data/balanced_train/balanced_train_03/ILCjO1sCcyM_570.0.mp4	Here comes Dada.	0.990	10.170
-6x2PtSRfJU	/public/huggingface-datasets/Aimind-dataset-share/Audioset/data/balanced_train/balanced_train_17/-6x2PtSRfJU_30.0.mp4	the whole mood of the show, you know, with the cowgirls and it's very campy and cute.	0.090	10.050
bT-CEaOEGdI	/public/huggingface-datasets/Aimind-dataset-share/Audioset/data/balanced_train/balanced_train_19/bT-CEaOEGdI_140.0.mp4	it gone and then if I was brave enough I'd actually try and do it with my hand I have done	0.750	10.860
FiBon2vPDvY	/public/huggingface-datasets/Aimind-dataset-share/Audioset/data/balanced_train/balanced_train_16/FiBon2vPDvY_0.0.mp4	Ding dong! Welcome to Candelas, Crib.	2.100	9.990
zXCxWEiqaw4	/public/huggingface-datasets/Aimind-dataset-share/Audioset/data/balanced_train/balanced_train_05/zXCxWEiqaw4_30.0.mp4	Then we add the onions and celery. We're gonna caramelize the onions. Oh yeah, the onions. Yeah.	0.000	13.350
LJ1pS1W0XXg	/public/huggingface-datasets/Aimind-dataset-share/Audioset/data/balanced_train/balanced_train_17/LJ1pS1W0XXg_30.0.mp4	Now to clear his name is taking the police hostage. I'm not going to jail today.	0.210	10.020
E5Re9mEEqXM	/public/huggingface-datasets/Aimind-dataset-share/Audioset/data/balanced_train/balanced_train_04/E5Re9mEEqXM_30.0.mp4	There we go.	0.000	14.760
beRAhGGzrnU	/public/huggingface-datasets/Aimind-dataset-share/Audioset/data/balanced_train/balanced_train_11/beRAhGGzrnU_10.0.mp4	So if you're watching a YouTube show called Thunk, it's probably a pretty safe bet that you value knowing things. Knowledge is power.	0.000	15.030
aceU1El-9mg	/public/huggingface-datasets/Aimind-dataset-share/Audioset/data/balanced_train/balanced_train_18/aceU1El-9mg_30.0.mp4	Looks like a man-made canal in here.	4.770	9.600
bkizsqzOewY	/public/huggingface-datasets/Aimind-dataset-share/Audioset/data/balanced_train/balanced_train_01/bkizsqzOewY_270.0.mp4	to a modeler's rasp. Almost there.	0.000	10.260
1kjnqM-ptrk	/public/huggingface-datasets/Aimind-dataset-share/Audioset/data/balanced_train/balanced_train_15/1kjnqM-ptrk_110.0.mp4	What the fuck, Chapo? Me and Keith were about to beat the shit out of this guy!	0.000	10.800
PG1xWRrwUkE	/public/huggingface-datasets/Aimind-dataset-share/Audioset/data/balanced_train/balanced_train_15/PG1xWRrwUkE_210.0.mp4	Now watch this!	0.000	10.440
cT756yS5seE	/public/huggingface-datasets/Aimind-dataset-share/Audioset/data/balanced_train/balanced_train_03/cT756yS5seE_120.0.mp4	could get a new random value at each press of the button and let it hang indefinitely. With nothing in the clock's CV input jack, it's attenuated by the	0.000	12.720
C45UcC1rag8	/public/huggingface-datasets/Aimind-dataset-share/Audioset/data/balanced_train/balanced_train_05/C45UcC1rag8_190.0.mp4	I'm just watching see what my consistency is like after it mixes a bit come look at it	2.130	10.020
jt5DbLRO4l0	/public/huggingface-datasets/Aimind-dataset-share/Audioset/data/balanced_train/balanced_train_03/jt5DbLRO4l0_520.0.mp4	That's not too bad for me now we're gonna try with the car	0.000	11.490
Gi-8aOA8B5Q	/public/huggingface-datasets/Aimind-dataset-share/Audioset/data/balanced_train/balanced_train_20/Gi-8aOA8B5Q_50.0.mp4	second string, and G7 should sound like this. To play C, put your third finger on the third fret of the first string, and C should sound like this.	0.000	12.030
b8AEdmKJebU	/public/huggingface-datasets/Aimind-dataset-share/Audioset/data/balanced_train/balanced_train_13/b8AEdmKJebU_140.0.mp4	the buffalo. They too are not left behind. For long the Said Kings of	0.000	13.080
nCPTRcZb4Bk	/public/huggingface-datasets/Aimind-dataset-share/Audioset/data/balanced_train/balanced_train_01/nCPTRcZb4Bk_450.0.mp4	I am spinning it so it fills up like a ball. And I am going to take it out. So it is vanilla flavor. If it didn't come well. So you	0.030	11.490
B-ryQi6V7nA	/public/huggingface-datasets/Aimind-dataset-share/Audioset/data/balanced_train/balanced_train_14/B-ryQi6V7nA_30.0.mp4	It uses the Miele GN bag and it's got new filters so this is going to be, slip out the old stuff, slip in the new.	0.180	14.190
kPsSzq1NEM4	/public/huggingface-datasets/Aimind-dataset-share/Audioset/data/balanced_train/balanced_train_19/kPsSzq1NEM4_100.0.mp4	Couple tomatoes squash more garlic and the seeds that I planted about a week ago, which is	0.000	14.970
Pn8HqUbNQAc	/public/huggingface-datasets/Aimind-dataset-share/Audioset/data/balanced_train/balanced_train_16/Pn8HqUbNQAc_30.0.mp4	Hi this is JJ with ElectroHarmonics and this is the Stereo Electric Mistress. This is an updated version of the classic ElectroHarmonics flanger	1.800	14.460
DJuJhFRWBYE	/public/huggingface-datasets/Aimind-dataset-share/Audioset/data/balanced_train/balanced_train_13/DJuJhFRWBYE_30.0.mp4	Welcome!	10.020	10.530
cQrcwFXs4hM	/public/huggingface-datasets/Aimind-dataset-share/Audioset/data/balanced_train/balanced_train_15/cQrcwFXs4hM_0.0.mp4	Elf on the Shelf, All the Rage for Christmas 2011 Santa's workshop is busy pumping out the latest American holiday	0.360	9.990
T6Nnh13dAok	/public/huggingface-datasets/Aimind-dataset-share/Audioset/data/balanced_train/balanced_train_01/T6Nnh13dAok_30.0.mp4	Well one way is to actually start making and producing your own music. If you think about it, if you do a mix tape, a mix CD, and you start making your own music,	0.000	10.020
D6xrH93lnoc	/public/huggingface-datasets/Aimind-dataset-share/Audioset/data/balanced_train/balanced_train_12/D6xrH93lnoc_30.0.mp4	But I just can't be when she's me about my let's go we know her name I feel ashamed But I know I don't want to blame she looking good	0.000	10.260
XCbGJ-bIkmg	/public/huggingface-datasets/Aimind-dataset-share/Audioset/data/balanced_train/balanced_train_08/XCbGJ-bIkmg_160.0.mp4	Whatever you have handy I used a file and a hacksaw blade just like this to get down	0.000	15.060
sOIKfmsjT2k	/public/huggingface-datasets/Aimind-dataset-share/Audioset/data/balanced_train/balanced_train_07/sOIKfmsjT2k_40.0.mp4	Now there's been a rush, but I still might	0.000	11.910
Z0HFSwKqfeU	/public/huggingface-datasets/Aimind-dataset-share/Audioset/data/balanced_train/balanced_train_01/Z0HFSwKqfeU_510.0.mp4	I have noticed that, especially on the harder alloy coins, it's good to start with a steel mandrel first so that you start the fold, that way there's	0.000	12.870
TvXx8c2j2KA	/public/huggingface-datasets/Aimind-dataset-share/Audioset/data/balanced_train/balanced_train_18/TvXx8c2j2KA_50.0.mp4	and nuts and you're going to blend. I'm going to start on low and then go up to high. Okay, once you've got it blended, you'll know it's done blending when the rattling stops. You can take a measuring cup or	0.000	11.550
sGeiUh95YEc	/public/huggingface-datasets/Aimind-dataset-share/Audioset/data/balanced_train/balanced_train_15/sGeiUh95YEc_30.0.mp4	that I can pull up and down on and create sounds like these rustling and twigs breaking. I will grunt and I will rattle at the same time as well.	0.570	10.020
1zoqi-E5vFY	/public/huggingface-datasets/Aimind-dataset-share/Audioset/data/balanced_train/balanced_train_14/1zoqi-E5vFY_50.0.mp4	I have my batting in my fabric here. It's really just a freeform wandering on your fabric. So I always start	0.060	9.900
PufDOSkxwzQ	/public/huggingface-datasets/Aimind-dataset-share/Audioset/data/balanced_train/balanced_train_12/PufDOSkxwzQ_550.0.mp4	And of course	0.000	14.460
Qp8zD7i5DiQ	/public/huggingface-datasets/Aimind-dataset-share/Audioset/data/balanced_train/balanced_train_19/Qp8zD7i5DiQ_30.0.mp4	Take that off. Now you've got a blow style. It's got the reed inside. Just take your hands, put it around there.	0.000	6.570
2TauJ1KBMdY	/public/huggingface-datasets/Aimind-dataset-share/Audioset/data/balanced_train/balanced_train_05/2TauJ1KBMdY_30.0.mp4	I have trained my mind and my body will fall. Who am I? I am a champion. I was known to factor my opponent. You do not expect me to win.	0.570	9.690
azlUFirpDLQ	/public/huggingface-datasets/Aimind-dataset-share/Audioset/data/balanced_train/balanced_train_12/azlUFirpDLQ_80.0.mp4	so tired of broken hearts and losing at this game before	0.000	11.220
SPwCIoxfQYM	/public/huggingface-datasets/Aimind-dataset-share/Audioset/data/balanced_train/balanced_train_08/SPwCIoxfQYM_30.0.mp4	You're going to be cooler after your hair cries? It's going to be easy to wash.	0.000	10.530
hud5lhoFWEM	/public/huggingface-datasets/Aimind-dataset-share/Audioset/data/balanced_train/balanced_train_14/hud5lhoFWEM_170.0.mp4	the or strapping down the the angle so it doesn't go flying over and hit something in the head so anyway so that the fridge sits up here locks and	0.630	11.340
uNPUAFx8tyg	/public/huggingface-datasets/Aimind-dataset-share/Audioset/data/balanced_train/balanced_train_02/uNPUAFx8tyg_30.0.mp4	Thank you.	0.450	10.200
IywDfIjWeIk	/public/huggingface-datasets/Aimind-dataset-share/Audioset/data/balanced_train/balanced_train_19/IywDfIjWeIk_240.0.mp4	and when it takes the rest from their bodies, they're all to the dust. Just like you. I would quite as well not rest on trying to debate anything.	0.120	10.020
aayUR43KzPI	/public/huggingface-datasets/Aimind-dataset-share/Audioset/data/balanced_train/balanced_train_05/aayUR43KzPI_300.0.mp4	administrative users. So that's the basic nuts and bolts of Remote Web Workplace as I said it	0.000	10.800
RMcuQrVFhDk	/public/huggingface-datasets/Aimind-dataset-share/Audioset/data/balanced_train/balanced_train_16/RMcuQrVFhDk_30.0.mp4	but believes it could be good for him and wants to find out if he's done something amazing to his body. Have I raised my level of my immune system? Have I stopped?	0.330	11.700
qW8zo5ib1nQ	/public/huggingface-datasets/Aimind-dataset-share/Audioset/data/balanced_train/balanced_train_11/qW8zo5ib1nQ_530.0.mp4	why we're doing this. Okay and then to the juice we're going to add two cans of white	0.000	12.030
4y0KbKCyKus	/public/huggingface-datasets/Aimind-dataset-share/Audioset/data/balanced_train/balanced_train_03/4y0KbKCyKus_140.0.mp4	Put down the automatic drive-side window and check out the exterior.	0.180	12.960
F4XKK8D22rY	/public/huggingface-datasets/Aimind-dataset-share/Audioset/data/balanced_train/balanced_train_09/F4XKK8D22rY_30.0.mp4	We would like to welcome Neil, Stevie, and Philimto here today. The entire show on the active TV show.	0.390	10.530
4LQMmbsOyKw	/public/huggingface-datasets/Aimind-dataset-share/Audioset/data/balanced_train/balanced_train_17/4LQMmbsOyKw_26.0.mp4	Are you guys just getting started over there?	0.000	9.810
tUUjM17zvFM	/public/huggingface-datasets/Aimind-dataset-share/Audioset/data/balanced_train/balanced_train_20/tUUjM17zvFM_40.0.mp4	We're able to be jumped!	0.480	10.710
OJfYSZzZOP8	/public/huggingface-datasets/Aimind-dataset-share/Audioset/data/balanced_train/balanced_train_20/OJfYSZzZOP8_260.0.mp4	provider will be my computer name. So my column and then the	0.000	14.070
sggM4ikIIBM	/public/huggingface-datasets/Aimind-dataset-share/Audioset/data/balanced_train/balanced_train_03/sggM4ikIIBM_410.0.mp4	Hey do you guys have ammo? You guys have ammo for this gun?	1.650	12.330
Eb-4KJ940fs	/public/huggingface-datasets/Aimind-dataset-share/Audioset/data/balanced_train/balanced_train_08/Eb-4KJ940fs_160.0.mp4	Let's try this again. Okay, here we go.	0.000	12.300
12gteLLmj2Q	/public/huggingface-datasets/Aimind-dataset-share/Audioset/data/balanced_train/balanced_train_16/12gteLLmj2Q_280.0.mp4	Why do people break?	7.530	10.470
uKoP9qz26RU	/public/huggingface-datasets/Aimind-dataset-share/Audioset/data/balanced_train/balanced_train_04/uKoP9qz26RU_30.0.mp4	I do have one of those too. Okay, let me get all the wires out of there.	0.690	9.930
lWDYbFDhV8k	/public/huggingface-datasets/Aimind-dataset-share/Audioset/data/balanced_train/balanced_train_02/lWDYbFDhV8k_20.0.mp4	It's very scary.	5.940	7.890
9BzZvj5W09s	/public/huggingface-datasets/Aimind-dataset-share/Audioset/data/balanced_train/balanced_train_19/9BzZvj5W09s_60.0.mp4	Start up the career.	0.660	9.840
pkRCVd5yCEM	/public/huggingface-datasets/Aimind-dataset-share/Audioset/data/balanced_train/balanced_train_07/pkRCVd5yCEM_10.0.mp4	So as you might	0.000	14.700
GEHTVQw2ql4	/public/huggingface-datasets/Aimind-dataset-share/Audioset/data/balanced_train/balanced_train_08/GEHTVQw2ql4_9.0.mp4	Ha ha ha	2.040	10.470
S7R3NMq3MKk	/public/huggingface-datasets/Aimind-dataset-share/Audioset/data/balanced_train/balanced_train_05/S7R3NMq3MKk_90.0.mp4	And don't you know that you can come with me With the funkiness and the rhythm of the SCC, yeah	0.000	11.400
MtSgDEoFqX0	/public/huggingface-datasets/Aimind-dataset-share/Audioset/data/balanced_train/balanced_train_12/MtSgDEoFqX0_50.0.mp4	hours, three or four hours and we'll check on it. Fantastic. All right, thank you. We'll see you in a bit.	0.420	10.980
hwxIPAuFfw8	/public/huggingface-datasets/Aimind-dataset-share/Audioset/data/balanced_train/balanced_train_05/hwxIPAuFfw8_10.0.mp4	edges or bumps and I know it won't hurt you. Retention means it's stained where it's supposed to be.	0.000	10.020
colnyHv9CAA	/public/huggingface-datasets/Aimind-dataset-share/Audioset/data/balanced_train/balanced_train_11/colnyHv9CAA_30.0.mp4	I want to never live life like this Never need so much	0.000	10.590
J0HWQBkDook	/public/huggingface-datasets/Aimind-dataset-share/Audioset/data/balanced_train/balanced_train_18/J0HWQBkDook_70.0.mp4	Breathe in through my nose and exhale through my mouth. Here we go.	0.000	5.220
ByZD9ujkkB4	/public/huggingface-datasets/Aimind-dataset-share/Audioset/data/balanced_train/balanced_train_13/ByZD9ujkkB4_50.0.mp4	I'm so bored! Oh, that's her!	0.300	10.290
ID1es90Br8E	/public/huggingface-datasets/Aimind-dataset-share/Audioset/data/balanced_train/balanced_train_17/ID1es90Br8E_280.0.mp4	I'm talking on your jacket	0.000	11.130
Zno9K9Rvlio	/public/huggingface-datasets/Aimind-dataset-share/Audioset/data/balanced_train/balanced_train_15/Zno9K9Rvlio_260.0.mp4	Thank you.	0.750	2.550
hiOjqskDlS0	/public/huggingface-datasets/Aimind-dataset-share/Audioset/data/balanced_train/balanced_train_04/hiOjqskDlS0_80.0.mp4	Pretty cool. We have a good instruction sheet and I also provide essentially some puzzles, things for you to try to try to decrypt.	0.000	10.770
EviorW0wbVo	/public/huggingface-datasets/Aimind-dataset-share/Audioset/data/balanced_train/balanced_train_10/EviorW0wbVo_500.0.mp4	audio 1, audio 2 and common ground again and when I plug into this jack what I	0.000	13.560
Th3mJWxUQ0w	/public/huggingface-datasets/Aimind-dataset-share/Audioset/data/balanced_train/balanced_train_01/Th3mJWxUQ0w_90.0.mp4	Hey Fred! And it's really nice out so I think I'm gonna go swimming later. My mom found this really cool pool at the dump. It's really big and really deep.	0.510	9.840
CYG7V1utLDg	/public/huggingface-datasets/Aimind-dataset-share/Audioset/data/balanced_train/balanced_train_08/CYG7V1utLDg_7.0.mp4	Some fucking dill on it!	2.910	10.530
kH-F9JzC7eE	/public/huggingface-datasets/Aimind-dataset-share/Audioset/data/balanced_train/balanced_train_08/kH-F9JzC7eE_80.0.mp4	horrible sound so make sure it's in between the two bars and for in a for	0.000	10.560
KkD7L5SWNN4	/public/huggingface-datasets/Aimind-dataset-share/Audioset/data/balanced_train/balanced_train_14/KkD7L5SWNN4_140.0.mp4	I promise I've done it a million times. Alright, two sides now.	0.240	5.820
MEVVVTPiN5E	/public/huggingface-datasets/Aimind-dataset-share/Audioset/data/balanced_train/balanced_train_03/MEVVVTPiN5E_30.0.mp4	Come on now, drive it!	0.330	10.050
8SYLYWR47EE	/public/huggingface-datasets/Aimind-dataset-share/Audioset/data/balanced_train/balanced_train_08/8SYLYWR47EE_30.0.mp4	Oh shit! Oh shit! Oh shit!	0.000	10.020
xiN6XwZNEJo	/public/huggingface-datasets/Aimind-dataset-share/Audioset/data/balanced_train/balanced_train_14/xiN6XwZNEJo_80.0.mp4	So, now it's easier and out of the way of your leg when we play on the ridge.	0.270	14.970
Bgcvw5VEabw	/public/huggingface-datasets/Aimind-dataset-share/Audioset/data/balanced_train/balanced_train_18/Bgcvw5VEabw_130.0.mp4	the camera here's the other card and it's got a C on it see it up in the left hand corner if y'all	0.000	14.070
t0903OliIqE	/public/huggingface-datasets/Aimind-dataset-share/Audioset/data/balanced_train/balanced_train_10/t0903OliIqE_0.0.mp4	This is a Maglite.	2.250	4.650
-oxF9jhY94s	/public/huggingface-datasets/Aimind-dataset-share/Audioset/data/balanced_train/balanced_train_19/-oxF9jhY94s_1.0.mp4	Next one.	3.150	9.270
MjfCH89sBzs	/public/huggingface-datasets/Aimind-dataset-share/Audioset/data/balanced_train/balanced_train_13/MjfCH89sBzs_70.0.mp4	Who knew Fronie's world was cool? Now wait for Saturday For the show to play What will it bring?	0.000	10.020
dOl5OnEHShU	/public/huggingface-datasets/Aimind-dataset-share/Audioset/data/balanced_train/balanced_train_11/dOl5OnEHShU_30.0.mp4	All I can give to you is loving	3.060	11.340
drVo5VQfsDc	/public/huggingface-datasets/Aimind-dataset-share/Audioset/data/balanced_train/balanced_train_03/drVo5VQfsDc_50.0.mp4	How's your bum by the way? How's your bum?	0.360	11.700
QBYtl0RfPIA	/public/huggingface-datasets/Aimind-dataset-share/Audioset/data/balanced_train/balanced_train_01/QBYtl0RfPIA_310.0.mp4	you with his chili peppers. Come on, Jawbreaker. Ah! Ah, man, he really liked that.	0.000	12.330
ZFG9jHrLtBE	/public/huggingface-datasets/Aimind-dataset-share/Audioset/data/balanced_train/balanced_train_09/ZFG9jHrLtBE_70.0.mp4	For the stab, you're going to more aggressively push the record in the forward position, and you're going to click the crossfader open quicker.	0.000	13.050
qOSdHmfwLF4	/public/huggingface-datasets/Aimind-dataset-share/Audioset/data/balanced_train/balanced_train_09/qOSdHmfwLF4_40.0.mp4	At the dinner table with my family all around My buddies got in making lots of funny little sounds	0.120	10.650
TnqqafJMXBU	/public/huggingface-datasets/Aimind-dataset-share/Audioset/data/balanced_train/balanced_train_10/TnqqafJMXBU_30.0.mp4	to a mid-range unison to make the effects of the controls easy to hear in the algorithm. The three voices are each composed of 24 sine waves.	0.000	10.440
NMYGTc5bzNY	/public/huggingface-datasets/Aimind-dataset-share/Audioset/data/balanced_train/balanced_train_04/NMYGTc5bzNY_90.0.mp4	You have to put it through the derailleur cage and you have to clear everything.	0.000	10.470
3XRjrSOVBnQ	/public/huggingface-datasets/Aimind-dataset-share/Audioset/data/balanced_train/balanced_train_18/3XRjrSOVBnQ_240.0.mp4	every habit and every expression as she moved toward independence.	0.000	7.770
